{
  "schema_version": 1,
  "source_kind": "nvapi_therm_channel_v2_observation",
  "capture_started_utc": "2026-08-25T22:27:08Z",
  "captured_utc": "2026-08-25T22:27:18Z",
  "duration_seconds": 10,
  "process_id": 1234,
  "gpuz_sha256": "6cb0ef29682452de81a9576808881685161411a1fad00938ba04131159979c29",
  "debugger_sha256": "1111111111111111111111111111111111111111111111111111111111111111",
  "debugger_file_version": "1.0.0.0",
  "candidate_inventory_sha256": "2222222222222222222222222222222222222222222222222222222222222222",
  "prior_observation_sha256": "3333333333333333333333333333333333333333333333333333333333333333",
  "nvapi_module_sha256": "fbc9aed43bfa5bda19b7f83a809a081a0ce454b6d6003dcabc565ecb3e6afdaf",
  "interface_id": "0x65fe3aad",
  "function_rva": "0x001ad310",
  "caller_module_name": "GPU-Z.exe",
  "caller_rva": "0x002225b5",
  "structure_version": "0x000200a8",
  "structure_size_bytes": 168,
  "fixed_point_fractional_bits": 8,
  "value_word_indices": [
    10,
    11
  ],
  "reference_log": {
    "size_bytes_before": 60,
    "size_bytes_midpoint": 67,
    "size_bytes_after": 74,
    "last_write_utc_before": "2026-08-25T22:27:08Z",
    "last_write_utc_midpoint": "2026-08-25T22:27:13Z",
    "last_write_utc_after": "2026-08-25T22:27:18Z",
    "last_sample_local_before": "2026-08-25 22:27:08",
    "last_sample_local_midpoint": "2026-08-25 22:27:13",
    "last_sample_local_after": "2026-08-25 22:27:18",
    "grew_during_capture": true
  },
  "call_count": 2,
  "samples": [
    {
      "sequence": 1,
      "thread_id": "0x00000001",
      "channel_index": 0,
      "return_status": "0x00000000",
      "structure_version": "0x000200a8",
      "channel_mask": "0x00000001",
      "raw_words": [
        "0x000200a8",
        "0x00000001",
        "0x00000000",
        "0x00000000",
        "0x00000000",
        "0x00000000",
        "0x00000000",
        "0x00000000",
        "0x00000000",
        "0x00000000",
        "0x00002150",
        "0x00000000",
        "0x00000000",
        "0x00000000",
        "0x00000000",
        "0x00000000",
        "0x00000000",
        "0x00000000",
        "0x00000000",
        "0x00000000",
        "0x00000000",
        "0x00000000",
        "0x00000000",
        "0x00000000",
        "0x00000000",
        "0x00000000",
        "0x00000000",
        "0x00000000",
        "0x00000000",
        "0x00000000",
        "0x00000000",
        "0x00000000",
        "0x00000000",
        "0x00000000",
        "0x00000000",
        "0x00000000",
        "0x00000000",
        "0x00000000",
        "0x00000000",
        "0x00000000",
        "0x00000000",
        "0x00000000"
      ],
      "selected_word_index": 10,
      "selected_raw_fixed_8": 8528,
      "selected_celsius": 33.3125
    },
    {
      "sequence": 2,
      "thread_id": "0x00000001",
      "channel_index": 1,
      "return_status": "0x00000000",
      "structure_version": "0x000200a8",
      "channel_mask": "0x00000002",
      "raw_words": [
        "0x000200a8",
        "0x00000002",
        "0x00000000",
        "0x00000000",
        "0x00000000",
        "0x00000000",
        "0x00000000",
        "0x00000000",
        "0x00000000",
        "0x00000000",
        "0x00000000",
        "0x00002b60",
        "0x00000000",
        "0x00000000",
        "0x00000000",
        "0x00000000",
        "0x00000000",
        "0x00000000",
        "0x00000000",
        "0x00000000",
        "0x00000000",
        "0x00000000",
        "0x00000000",
        "0x00000000",
        "0x00000000",
        "0x00000000",
        "0x00000000",
        "0x00000000",
        "0x00000000",
        "0x00000000",
        "0x00000000",
        "0x00000000",
        "0x00000000",
        "0x00000000",
        "0x00000000",
        "0x00000000",
        "0x00000000",
        "0x00000000",
        "0x00000000",
        "0x00000000",
        "0x00000000",
        "0x00000000"
      ],
      "selected_word_index": 11,
      "selected_raw_fixed_8": 11104,
      "selected_celsius": 43.375
    }
  ],
  "warning": "Synthetic fixed-profile observation used only by hardware-independent tests."
}
